{
  "schema_version": "0.1.0",
  "project": "Example three-lane hotload",
  "recorded_at": "2026-09-27T00:00:00-04:00",
  "notes": "Seed list is a hint. Live join/continue order fills roles. Tool identity irrelevant. Boss lease default 30 minutes (15–120); watchdog agent-less ~10m. After vacancy, the claim-file claim_queue is FIFO; old boss rejoins at end. The claim file is the authoritative seat store. FULL PCM + FULL CGM 0.5.12 required — not a slim HSW/writing-direction-only subset.",
  "role_fill": {
    "mode": "join_continue_order",
    "seed_is_hint_only": true,
    "notes": "First continuer = decision boss; next = coder1; next = coder2."
  },
  "agents": [
    {
      "agent_id": "agent-a@primary",
      "role_seed": "decision_boss",
      "harness": "claude-code",
      "machine_label": "primary",
      "may_implement": true,
      "notes": "Seed hint for empty room; live join order wins when filling."
    },
    {
      "agent_id": "agent-b@workstation",
      "role_seed": "coder",
      "harness": "codex",
      "machine_label": "workstation",
      "may_implement": true,
      "notes": "Worker/coder seed."
    },
    {
      "agent_id": "agent-c@laptop",
      "role_seed": "coder",
      "harness": "kilo",
      "machine_label": "laptop",
      "may_implement": true,
      "notes": "Worker/coder seed."
    }
  ],
  "boss_failover": {
    "lease_ttl_minutes": 30,
    "check_in": {
      "mechanism": "issue_comment",
      "interval_hint_minutes": 15,
      "issue_url": "https://github.com/Pukujan/agent-custom-setup/issues/11",
      "claim_file_path": ".coord/boss_claim.json"
    },
    "claim_queue": [],
    "standby": [
      "agent-b@workstation",
      "agent-c@laptop"
    ],
    "grace_minutes": 10,
    "who_is_boss_now": "agent-a@primary",
    "as_of_history": [
      {
        "as_of": "2026-09-27T00:00:00-04:00",
        "boss_agent_id": "agent-a@primary",
        "ended_at": null,
        "notes": "Illustrative seed; append on failover — do not rewrite."
      }
    ]
  },
  "watchdog": {
    "watchdog_interval_minutes": 10,
    "idle_window": {
      "minutes": 20
    },
    "runner": "github_action",
    "inputs": [
      "claim_heartbeat",
      "github_commit",
      "github_pr",
      "local_telemetry_optional"
    ],
    "on_fresh_heartbeat": "noop",
    "on_stale_with_github_activity": "nudge_check_in_keep_boss",
    "on_stale_idle": "flag_seat_at_risk",
    "on_past_lease_ttl": "write_vacant_in_claim_file",
    "notes": "AGENT-LESS. Cron/Action/script only. No LLM. No peer agent. Watchdog != failover. ~10m liveness/nudge only."
  },
  "pins": {
    "pcm": {
      "repo": "https://github.com/Pukujan/project-continuity-modules",
      "revision": "0000000000000000000000000000000000000000",
      "cli_version": "0.7.0",
      "protocol": "0.1.0-draft",
      "role": "full_stack",
      "required_features": [
        "checkout_continuity_checkpoints",
        "github_issues_own_task_progression",
        "pr_only_to_default_branch",
        "required_ci_gates",
        "branch_protection_preference",
        "github_auto_merge_preference",
        "fail_closed_on_missing_gates",
        "leaf_parent_dependency_receipts"
      ],
      "notes": "The pin revision is a RESERVED PLACEHOLDER (all-zero), rebuilt from the stack commit by acs_install.build_assignment; never pin a real commit here. Full PCM for adopters. Continuity/checkpoints yes; still NOT the proposal/ACCEPT layer (that stays GitHub + PROPOSALS.md). Pin commit SHA; do not silently follow moving main. Do not vendor PCM source into ACS."
    },
    "cgm": {
      "repo": "https://github.com/Pukujan/content-generation-modules",
      "revision": "0000000000000000000000000000000000000000",
      "version": "0.5.12",
      "role": "full_stack",
      "modules": [
        "brand-foundation",
        "content-context",
        "writing-direction",
        "human-sounding-writing",
        "human-output-naming",
        "visual-direction",
        "image-generation",
        "html-demo"
      ],
      "human_output_contract": [
        "docs/README_PLAYBOOK.md",
        "templates/README.template.md",
        "templates/readme-contract.json",
        "schemas/readme-contract.schema.json",
        "docs/README_QUALITY_PDD.md",
        "docs/README_QUALITY_SDD.md",
        "docs/README_QUALITY_TDD.md",
        "docs/PROVENANCE_AND_CITATION.md",
        "docs/WRITING_ROUTING.md",
        "docs/ACS_VERIFY.md",
        "docs/writing-routing.json",
        "docs/HUMAN_SOUNDING_WRITING.md",
        "docs/human-sounding-rules.json",
        "docs/IMAGE_GUIDE.md",
        "docs/CONTENT_RESEARCH.md",
        "docs/BRAND_DIRECTION.md",
        "AGENTS.md",
        "system-version.json",
        "docs/HUMAN_OUTPUT_NAMING.md",
        "docs/human-output-naming.json"
      ],
      "routing": {
        "readme_product_entry": "writing-direction (MUST load; scan-first selective bold; do not apply HSW bold restraints)",
        "pr_issue_docs_commits": "human-sounding-writing / hsw (MUST load for PR/issue titles+bodies, docs, commits)",
        "posts_blogs_papers": "human-sounding-writing (hsw / HSW)",
        "contract": "docs/writing-routing.json + docs/ACS_VERIFY.md — application=must_load; human_facing_default; acs_prompt_inject after VALID",
        "html_reports_compare_appendable": "human-sounding-writing / hsw (MUST; default ON; no per-report opt-in)",
        "generated_artifact_filenames": "human-output-naming / hon (MUST; basenames + legends)"
      },
      "notes": "The pin revision is a RESERVED PLACEHOLDER (all-zero), rebuilt from the stack commit by acs_install.build_assignment; never pin a real commit here. FULL CGM 0.5.12 required for ACS and all hotloader adopters. Eight modules including human-output-naming. Not HSW+writing-direction only. MUST load modules per writing-routing.json (README→writing-direction; human-facing prose/HTML/compare/appendable→hsw default ON; basenames→hon). Pin SHA; validate with scripts/validate_content_system.py (full adapter); then apply acs_prompt_inject (application, human_facing_default, routes, apply_checklist). Do not vendor CGM source into ACS."
    }
  },
  "ticket_links": {
    "parent_issue": null,
    "child_issues": [],
    "notes": "Parent/child notes only; no full DAG engine."
  }
}
